{
  "pattern_id": "mp-bin-4-knife-peanut",
  "allergen_unit_id": "peanut",
  "source_entity_id": "bin-4",
  "source_label": "satay sauce",
  "via_kind": "knife",
  "occurrences": 5,
  "shifts": 2,
  "first_t_ms": 183580,
  "last_t_ms": 902100,
  "example_verdict_ids": ["v-t7-1", "v-t19-1"],
  "suggested_fix": "bin-4 keeps contaminating knives; give it its own utensil"
}
